{
  "id": "hackernews-20260730-001",
  "title": "Languages as designed latent spaces",
  "source": "hackernews",
  "source_url": "https://blog.jsbarretto.com/post/languages-as-latent-spaces",
  "author": "N/A",
  "summary": "文章将编程语言类比为AI的潜在空间，探讨语言设计如何塑造思维与表达，提出语言是精心设计的潜在空间。",
  "content": "## 项目概述\n\n该文章来自博客 jsbarretto.com，标题为“Languages as designed latent spaces”，将编程语言与AI中的潜在空间概念进行类比。作者认为编程语言不仅是工具，更是精心设计的潜在空间，影响开发者的思维方式和表达方式。\n\n## 核心特性\n\n- **类比创新**：将编程语言的语法、语义和设计哲学与AI潜在空间的维度、结构和表示能力进行对比。\n- **思维塑造**：探讨语言设计如何限制或扩展开发者的思考模式，类似于潜在空间对数据表示的约束。\n- **设计哲学**：强调语言设计是有意识的选择，类似于AI模型中潜在空间的设计。\n\n## 适用场景\n\n- 对编程语言设计感兴趣的技术人员\n- 希望从AI视角理解语言本质的研究者\n- 技术哲学和认知科学爱好者\n\n## 总结\n\n文章提供了一个跨学科的视角，将编程语言与AI潜在空间联系起来，适合作为技术哲学讨论的素材，但并非直接的技术教程或工具介绍。",
  "highlights": [
    "将编程语言类比为AI潜在空间，提供新颖视角",
    "探讨语言设计对思维和表达的影响",
    "提出语言是精心设计的潜在空间的观点"
  ],
  "score_reason": "文章从类比角度探讨编程语言与AI潜在空间的关系，有一定技术关联，但非直接AI/LLM技术内容。",
  "tags": [
    "opinion",
    "framework"
  ],
  "relevance_score": 0.5,
  "collected_at": "2026-07-30T10:52:56.506927+08:00",
  "analyzed_at": "2026-07-30T18:18:17.352413+08:00",
  "status": "reviewed"
}