{
  "id": "hackernews-20260813-016",
  "title": "Tensor is the might",
  "source": "hackernews",
  "source_url": "https://zserge.com/posts/tensor/",
  "author": "N/A",
  "summary": "一篇关于张量（Tensor）在计算机科学中重要性的技术文章，探讨其作为数据表示和计算核心的概念，以及在现代AI和科学计算中的应用。",
  "content": "## 项目概述\n\n本文《Tensor is the might》来自 zserge.com，是一篇技术文章，探讨了张量（Tensor）这一数学概念在计算机科学中的核心地位。文章从张量的基本定义出发，延伸到其在深度学习、科学计算和现代编程语言中的实际应用，强调了张量作为数据表示和计算抽象的重要性。\n\n## 核心特性\n\n- **基础概念清晰**：文章用通俗的语言解释了张量的维度、形状和运算，适合初学者理解。\n- **应用场景广泛**：涵盖了从机器学习到物理模拟的多个领域，展示了张量的通用性。\n- **编程视角**：讨论了如何在编程语言中实现和优化张量操作，涉及内存布局和性能考量。\n\n## 适用场景\n\n- 对AI和深度学习感兴趣的开发者，希望理解底层数据结构的原理。\n- 需要设计或优化数值计算库的工程师。\n- 技术爱好者希望扩展对现代计算范式的认知。\n\n## 总结\n\n这篇文章是一篇优秀的入门级技术文章，虽然不直接涉及LLM或Agent的具体实现，但为理解AI系统的底层机制提供了必要的基础。对于技术分析而言，它属于中等相关，值得一读但非核心内容。",
  "highlights": [
    "深入浅出地解释了张量的数学定义和实际应用",
    "讨论了张量在深度学习、物理模拟等领域的核心作用",
    "提供了从基础到进阶的视角，适合技术爱好者阅读"
  ],
  "score_reason": "文章与AI/LLM相关，但更偏向基础概念和通用计算，而非直接聚焦于LLM或Agent技术，属于中等相关。",
  "tags": [
    "framework",
    "tutorial",
    "llm"
  ],
  "relevance_score": 0.6,
  "collected_at": "2026-08-13T17:04:57.360498+08:00",
  "analyzed_at": "2026-08-13T17:08:14.972948+08:00",
  "status": "reviewed"
}