{
  "id": "github-trending-20260810-005",
  "title": "n8n-io/n8n",
  "source": "github-trending",
  "source_url": "https://github.com/n8n-io/n8n",
  "author": "n8n-io",
  "summary": "n8n 是一个开源的可视化工作流自动化平台，支持原生 AI 能力集成，通过拖拽式节点编排实现复杂业务流程自动化，兼具灵活性与公平代码许可。",
  "content": "## 项目概述\n\nn8n 是一个 **Fair-code 许可** 的开源工作流自动化平台，核心价值在于将**可视化编程**与**AI 能力**深度融合。它允许用户通过拖拽节点的方式，将不同的应用、API 和 AI 模型连接起来，构建从简单任务自动化到复杂 AI Agent 工作流的各种场景。\n\n## 核心特性\n\n- **可视化编排**：提供直观的拖拽式画布，支持条件逻辑、循环、错误处理等复杂流程设计，降低自动化开发门槛。\n- **原生 AI 集成**：内置 LLM 节点、Agent 节点、向量存储节点等，可轻松构建 RAG 应用、AI 客服、内容生成等智能工作流。\n- **丰富的集成生态**：拥有超过 400 个集成节点，覆盖主流 SaaS 应用、数据库、开发者工具，方便连接现有系统。\n- **灵活部署**：支持云托管和自托管（Docker、npm），满足不同数据安全和合规要求。\n- **开发者友好**：提供 API、Webhook 和自定义节点开发能力，便于扩展和二次开发。\n\n## 适用场景\n\n- **AI Agent 应用**：作为 Agent 的编排层，串联模型调用、工具使用和外部数据源。\n- **业务流程自动化**：自动化 CRM 更新、邮件处理、数据同步等重复性工作。\n- **RAG 应用开发**：快速搭建文档问答、知识库检索等基于向量检索的应用。\n- **内部工具集成**：连接内部系统与外部服务，构建统一的工作流入口。\n\n## 技术亮点\n\nn8n 的独特之处在于其 **Fair-code 模式**，在开放核心功能的同时，通过可选的商业功能实现可持续运营。其 AI 节点设计遵循 LangChain 等主流框架的抽象，使得开发者可以灵活切换不同的模型提供商（OpenAI、Anthropic、本地模型等），同时保持工作流的可视化可控性。",
  "highlights": [
    "可视化拖拽式工作流编排，无需代码即可构建复杂自动化流程",
    "原生集成 AI/LLM 节点，支持调用大模型、构建 Agent 和 RAG 应用",
    "Fair-code 许可，核心功能开源，支持自托管部署，数据安全可控",
    "拥有 400+ 集成节点，覆盖主流 SaaS、数据库、API 服务",
    "支持条件分支、错误处理、队列任务等高级工作流特性"
  ],
  "score_reason": "n8n 作为工作流自动化平台，原生支持 AI Agent 和 LLM 集成，是构建 AI 应用编排层的重要工具，与 AI 技术栈高度相关。",
  "tags": [
    "agent",
    "framework",
    "open-source",
    "deployment",
    "tool-use"
  ],
  "relevance_score": 0.8,
  "collected_at": "2026-08-10T17:10:39.134415+08:00",
  "analyzed_at": "2026-08-10T17:11:17.113555+08:00",
  "status": "reviewed"
}