{
  "id": "hackernews-20260813-007",
  "title": "Categorization with NLP",
  "source": "hackernews",
  "source_url": "https://softwaremaniacs.org/blog/2026/07/30/categorization-with-nlp/en/",
  "author": "N/A",
  "summary": "本文探讨使用NLP进行文本分类，强调传统方法（如TF-IDF和简单模型）在多数场景下优于复杂深度学习，并给出实用建议。",
  "content": "## 项目概述\n本文是一篇技术博客，作者基于实际经验讨论如何使用NLP进行文本分类（categorization）。文章指出，在许多实际场景中，传统方法（如TF-IDF、朴素贝叶斯、逻辑回归）往往比复杂的深度学习模型（如BERT）更高效、更易维护，尤其当数据量有限或对延迟敏感时。\n\n## 核心特性\n- **方法对比**：详细对比传统NLP（词频、TF-IDF）与深度学习方法（词向量、Transformer）的优缺点。\n- **实用建议**：强调数据清洗、标注质量、类别平衡的重要性，并推荐从简单模型开始逐步迭代。\n- **流程指导**：给出从数据准备到模型评估的完整分类流程，包括交叉验证和误差分析。\n\n## 适用场景\n- 中小规模文本分类任务（如新闻分类、邮件过滤、工单分派）。\n- 对模型可解释性和部署成本有要求的场景。\n- 作为入门NLP分类的实践指南，适合开发者参考。\n\n## 总结\n文章观点务实，反对过度工程化，适合希望快速落地分类功能的团队。虽未涉及最新LLM技术，但其中的方法论对AI应用仍有借鉴意义。",
  "highlights": [
    "对比传统NLP与现代深度学习方法，指出简单方案常更有效",
    "提供文本分类的实用流程和技巧，包括特征工程与模型选择",
    "强调数据质量与标注的重要性，而非盲目追求复杂模型"
  ],
  "score_reason": "文章涉及NLP分类技术，与AI相关但非LLM/Agent前沿，属于传统NLP范畴，对实践有参考价值。",
  "tags": [
    "tutorial"
  ],
  "relevance_score": 0.6,
  "collected_at": "2026-08-13T17:04:57.360498+08:00",
  "analyzed_at": "2026-08-13T17:07:29.274224+08:00",
  "status": "reviewed"
}