{
  "id": "hackernews-20260808-005",
  "title": "Why we write our own C and C++ inference engines",
  "source": "hackernews",
  "source_url": "https://localai.io/blog/why-we-write-our-own-engines/",
  "author": "N/A",
  "summary": "LocalAI 团队解释为何自研 C/C++ 推理引擎，以提升性能、控制依赖并优化特定硬件，而非依赖现成框架。",
  "content": "## 项目概述\n\nLocalAI 团队在博客中阐述了他们为何选择自研 C/C++ 推理引擎，而非直接使用现成的推理框架（如 llama.cpp 或 TensorRT）。核心动机在于对性能、可控性和硬件适配的极致追求。\n\n## 核心特性\n\n- **性能优化**：自研引擎可针对特定硬件（如 CPU 指令集、GPU 架构）进行深度优化，减少不必要的抽象层，提升推理速度。\n- **依赖控制**：减少对外部库的依赖，降低维护成本，避免版本冲突和供应链风险。\n- **灵活性**：支持多种模型格式（如 GGUF、ONNX），并能快速适配新模型架构。\n- **可嵌入性**：引擎设计为轻量级，便于集成到不同应用中。\n\n## 适用场景\n\n- 需要极致推理性能的生产环境\n- 对依赖管理有严格要求的嵌入式或边缘设备\n- 需要快速迭代支持新模型的研究团队\n\n## 技术分析\n\n文章深入讨论了自研引擎的工程挑战，包括内存管理、算子优化和跨平台兼容性。作者强调，虽然现成框架提供了便利，但在特定场景下，自研引擎能带来 2-3 倍的性能提升，并减少 50% 以上的内存占用。\n\n## 总结\n\nLocalAI 的自研引擎策略体现了对底层技术的深度掌控，适合追求高性能和高度定制化的 AI 部署场景。",
  "highlights": [
    "自研引擎针对特定硬件优化，性能显著提升",
    "减少外部依赖，增强可维护性和可控性",
    "支持多种模型格式，灵活适配不同场景"
  ],
  "score_reason": "文章聚焦推理引擎的底层实现，与AI部署和性能优化高度相关，但非LLM/Agent核心创新，故评7分。",
  "tags": [
    "deployment",
    "framework",
    "open-source"
  ],
  "relevance_score": 0.7,
  "collected_at": "2026-08-08T16:31:35.412658+08:00",
  "analyzed_at": "2026-08-08T16:34:07.717184+08:00",
  "status": "reviewed"
}