{
  "id": "github-trending-20260812-001",
  "title": "openclaw/openclaw",
  "source": "github-trending",
  "source_url": "https://github.com/openclaw/openclaw",
  "author": "openclaw",
  "summary": "openclaw 是一个开源个人 AI 助手项目，强调跨平台兼容性，可在任何操作系统和平台上运行，旨在提供高度可定制和本地化的智能助理体验。",
  "content": "## 项目概述\n\nopenclaw 是一个在 GitHub 上迅速走红的开源项目，其核心定位是 **\"Your own personal AI assistant\"**（你自己的个人 AI 助手）。项目描述中特别强调了 **\"Any OS. Any Platform.\"**（任何操作系统，任何平台），表明其设计目标在于打破平台壁垒，提供跨设备、跨系统的统一 AI 助手体验。\n\n## 核心特性\n\n- **跨平台兼容性**：这是项目最突出的卖点，意味着用户可以在桌面、移动端、甚至嵌入式设备上部署和使用同一个 AI 助手，无需针对不同系统进行适配。\n- **开源与自主性**：作为开源项目，用户拥有对代码和数据的完全控制权，可以深度定制助手行为，并避免依赖封闭的云服务。\n- **个人化定位**：区别于通用聊天机器人，该项目更侧重于作为个人助理，可能涉及任务自动化、信息管理、日程安排等场景。\n\n## 适用场景\n\n- **开发者与极客**：喜欢自托管、定制化 AI 工具的技术人群，可以在多设备上部署自己的助手。\n- **隐私敏感用户**：希望避免数据上传到第三方云平台，追求本地化 AI 处理的用户。\n- **跨设备工作流**：需要在不同操作系统（如 Windows、macOS、Linux、Android、iOS）之间无缝切换并保持 AI 助手状态一致的用户。\n\n## 技术分析\n\n虽然项目描述未提供详细的技术栈信息，但结合其定位，可以推测其底层可能涉及：\n- **LLM 集成**：作为 AI 助手，必然需要接入大语言模型（如 GPT、Llama 等）进行自然语言理解和生成。\n- **Agent 架构**：为了执行任务，可能采用了 Agent 模式，支持工具调用和任务规划。\n- **跨平台运行时**：可能使用 Rust、Go 或 Electron 等框架来实现跨平台能力。\n\n## 总结\n\nopenclaw 凭借其“跨平台 + 开源个人助手”的定位，在 GitHub 上获得了极高关注。它迎合了当前 AI 应用从云端走向本地、从通用走向个人的趋势。不过，项目仍处于早期阶段，其实际功能、稳定性和生态建设有待进一步观察。对于关注 AI Agent 和本地化部署的开发者而言，这是一个值得跟踪的项目。",
  "highlights": [
    "跨平台支持：宣称支持任何操作系统和平台，具备极高的可移植性",
    "开源个人助手：定位为个人专属 AI 助手，强调用户自主掌控",
    "高热度：GitHub 趋势榜项目，热度达 386k，社区关注度高"
  ],
  "score_reason": "该项目属于 AI 助手领域，与 LLM 应用和 Agent 高度相关，但描述信息有限，未明确技术栈或创新点，故评分为 8。",
  "tags": [
    "agent",
    "llm",
    "open-source",
    "framework",
    "deployment"
  ],
  "relevance_score": 0.8,
  "collected_at": "2026-08-12T17:04:38.564414+08:00",
  "analyzed_at": "2026-08-12T17:04:51.771613+08:00",
  "status": "reviewed"
}