{
  "id": "hackernews-20260730-003",
  "title": "A tour of MLIR: The Dialect Stack Everyone Depends On",
  "source": "hackernews",
  "source_url": "https://hiraditya.github.io/posts/mlir-dialect-stack-for-ml/",
  "author": "N/A",
  "summary": "本文深入介绍MLIR的方言栈结构，阐述其作为现代编译器基础设施核心，尤其在AI和机器学习领域的关键作用。",
  "content": "## 项目概述\n本文是一篇技术博客，系统性地介绍了MLIR（多级中间表示）的方言栈结构。MLIR是LLVM项目的一部分，旨在通过分层、可扩展的中间表示，简化编译器基础设施的构建，尤其在AI和机器学习领域，已成为现代编译器核心。\n\n## 核心特性\n- **方言栈设计**：MLIR通过多个方言（Dialect）层叠，从高层抽象（如TensorFlow、PyTorch）到底层硬件指令，实现渐进式降级。\n- **可扩展性**：支持自定义方言，便于集成新硬件或优化策略。\n- **跨领域适用**：不仅限于AI，还适用于HPC、GPU编程等场景。\n- **性能优化**：通过多级优化通道，提升代码生成效率。\n\n## 适用场景\n- AI模型编译器开发（如TensorFlow、PyTorch的底层优化）\n- 硬件加速器（GPU、TPU、NPU）的代码生成\n- 需要自定义中间表示的高性能计算项目\n- 编译器框架研究与教学\n\n## 总结\n本文为MLIR初学者和从业者提供了清晰的方言栈概览，是理解现代AI编译器基础设施的重要参考资料。",
  "highlights": [
    "详细解析MLIR方言栈的分层设计",
    "强调MLIR在AI编译器中的核心地位",
    "提供实际应用案例与性能优化思路"
  ],
  "score_reason": "MLIR是AI编译器基础设施的核心技术，本文深入介绍其方言栈，对理解AI模型部署与优化高度相关。",
  "tags": [
    "llm",
    "framework",
    "deployment"
  ],
  "relevance_score": 0.8,
  "collected_at": "2026-07-30T10:52:56.506927+08:00",
  "analyzed_at": "2026-07-30T18:18:25.467069+08:00",
  "status": "reviewed"
}