{
  "id": "github-trending-20260814-003",
  "title": "affaan-m/ECC",
  "source": "github-trending",
  "source_url": "https://github.com/affaan-m/ECC",
  "author": "affaan-m",
  "summary": "ECC 是一个开源的 Agent 性能优化系统，通过引入 Skills 机制来提升 Agent 的执行效率与能力边界。",
  "content": "## 项目概述\n\nECC (Agent Harness Performance Optimization System) 是一个专注于提升 AI Agent 执行效率的开源项目。其核心创新在于引入了 **Skills** 机制，旨在通过模块化技能库的方式，增强 Agent 在复杂任务中的表现。\n\n## 核心特性\n\n- **Skills 机制**：将常用操作或领域知识封装为可复用的技能模块，Agent 可以按需调用，减少重复推理开销。\n- **性能优化**：针对 Agent 的 harness 层（即控制循环、工具调用等基础设施）进行系统级优化，而非仅优化模型本身。\n- **开源生态**：项目以开源形式发布，允许开发者贡献新的技能模块或优化策略。\n\n## 适用场景\n\n- 需要构建高吞吐量 Agent 服务的团队\n- 研究 Agent 架构与性能调优的开发者\n- 希望复用领域技能（如代码生成、数据分析）的 Agent 应用\n\n## 技术分析\n\n该项目与当前 Agent 领域的热点（如工具使用、模块化设计）高度契合。通过将技能与推理分离，ECC 可能降低 Agent 的延迟和 token 消耗。不过，由于描述信息有限，其具体实现细节（如技能如何定义、如何与主流框架集成）尚不明确，需要进一步查看仓库代码。\n\n## 总结\n\nECC 是一个有潜力的 Agent 性能优化框架，其 Skills 理念值得关注。对于从事 Agent 工程化或性能调优的开发者，这是一个值得跟踪的项目。",
  "highlights": [
    "引入 Skills 机制，为 Agent 提供可复用的技能模块",
    "专注于 Agent harness 层面的性能优化",
    "开源项目，便于社区贡献与二次开发"
  ],
  "score_reason": "该项目直接针对 Agent 性能优化，属于 AI Agent 领域的高相关技术内容，但描述信息有限，未达到突破性标准。",
  "tags": [
    "agent",
    "framework",
    "open-source"
  ],
  "relevance_score": 0.8,
  "collected_at": "2026-08-14T17:00:47.588146+08:00",
  "analyzed_at": "2026-08-14T17:01:11.338319+08:00",
  "status": "reviewed"
}