{
  "id": "github-trending-20260822-017",
  "title": "Comfy-Org/ComfyUI",
  "source": "github-trending",
  "source_url": "https://github.com/Comfy-Org/ComfyUI",
  "author": "Comfy-Org",
  "summary": "ComfyUI 是一个功能强大且模块化的开源扩散模型图形界面，通过节点式工作流实现高度灵活的图像生成与控制。",
  "content": "## 项目概述\n\nComfyUI 是一个开源、模块化的扩散模型图形用户界面（GUI），旨在为用户提供最强大、最灵活的图像生成和控制体验。它通过节点式（Node-based）工作流，让用户能够以可视化方式构建复杂的图像生成管线，从而实现对生成过程的精细控制。\n\n## 核心特性\n\n- **节点式工作流**：将图像生成过程分解为多个可连接的节点（如加载模型、提示词编码、采样、解码等），用户可自由组合和调整，实现高度定制化。\n- **多模型支持**：原生支持 Stable Diffusion 及其衍生模型，并可通过插件扩展支持更多扩散模型。\n- **精细控制**：支持 ControlNet、LoRA、超网络等多种控制方式，可精确控制生成图像的构图、风格和细节。\n- **性能优化**：支持 GPU 加速，并针对低显存环境进行了优化，可在消费级显卡上流畅运行。\n- **本地部署**：完全本地运行，无需上传数据，保障用户隐私安全。\n- **社区生态**：拥有活跃的社区，提供大量自定义节点、工作流模板和教程，持续扩展功能边界。\n\n## 适用场景\n\n- **AI 艺术创作**：艺术家和设计师利用其精细控制能力创作高质量数字艺术作品。\n- **图像编辑与修复**：通过局部重绘、图生图等功能进行专业级图像修改。\n- **研究与实验**：研究人员可快速搭建实验环境，测试不同模型和参数组合。\n- **工作流自动化**：通过 API 或命令行接口，将图像生成集成到自动化生产流程中。\n\n## 总结\n\nComfyUI 凭借其模块化设计和强大的控制能力，已成为 AI 图像生成领域最受欢迎的开源工具之一。它不仅是技术爱好者的玩具，更是专业创作者和研究者的高效生产力工具。",
  "highlights": [
    "节点式模块化工作流，支持高度自定义",
    "支持多种扩散模型（如 Stable Diffusion）",
    "强大的图像生成与编辑控制能力",
    "活跃的开源社区与持续更新",
    "支持本地部署，保护隐私"
  ],
  "score_reason": "ComfyUI 是扩散模型领域的核心工具，虽非直接 LLM/Agent 项目，但作为 AI 图像生成的重要开源框架，与 AI 技术生态高度相关，值得关注。",
  "tags": [
    "open-source",
    "framework",
    "multimodal",
    "deployment",
    "tool-use"
  ],
  "relevance_score": 0.8,
  "collected_at": "2026-08-22T16:20:09.464625+08:00",
  "analyzed_at": "2026-08-22T16:21:53.308221+08:00",
  "status": "reviewed"
}