{
  "id": "github-trending-20260724-008",
  "title": "text-to-cad",
  "source": "github-trending",
  "source_url": "https://github.com/earthtojake/text-to-cad",
  "author": "earthtojake",
  "summary": "面向 CAD、机器人和硬件设计的 Agent 技能集合库。提供 11 个专用 Agent Skill，包括 CAD 建模（从自然语言或图片生成 STEP/STL/3MF/GLB 文件）、CAD 浏览器预览、标准件查找(step.parts)、2D DXF 图纸、URDF 机器人结构描述、SRDF MoveIt2 运动规划、SDF 仿真、线切割文件检查（SendCutSend）、G-code 生成、Bambu Lab 3D 打印控制等。支持通过 npx skills 安装及 Codex/Claude Code 插件市场安装。",
  "content": "面向 CAD、机器人和硬件设计的 Agent 技能集合库。提供 11 个专用 Agent Skill，包括 CAD 建模（从自然语言或图片生成 STEP/STL/3MF/GLB 文件）、CAD 浏览器预览、标准件查找(step.parts)、2D DXF 图纸、URDF 机器人结构描述、SRDF MoveIt2 运动规划、SDF 仿真、线切割文件检查（SendCutSend）、G-code 生成、Bambu Lab 3D 打印控制等。支持通过 npx skills 安装及 Codex/Claude Code 插件市场安装。\n\n## 核心亮点\n\n- 11 个专用 Agent Skill 覆盖 CAD 设计→制造→机器人仿真的完整工作流\n- 支持自然语言生成 3D 模型，输出 STEP/STL/3MF/GLB 多种格式\n- 集成 MoveIt2 运动规划和 3D 打印机直接控制\n\n## 评分理由\n\nAgent Skill 在 CAD/机器人领域的垂直应用，展示了 Agent 工具使用的实际场景，但与 AI/LLM 核心技术关联度一般",
  "highlights": [
    "11 个专用 Agent Skill 覆盖 CAD 设计→制造→机器人仿真的完整工作流",
    "支持自然语言生成 3D 模型，输出 STEP/STL/3MF/GLB 多种格式",
    "集成 MoveIt2 运动规划和 3D 打印机直接控制"
  ],
  "score_reason": "Agent Skill 在 CAD/机器人领域的垂直应用，展示了 Agent 工具使用的实际场景，但与 AI/LLM 核心技术关联度一般",
  "tags": [
    "agent",
    "tool-use",
    "open-source",
    "multimodal"
  ],
  "relevance_score": 6,
  "collected_at": "2026-07-24T10:30:00+08:00",
  "analyzed_at": "2026-07-24T15:00:00+08:00",
  "status": "reviewed"
}