{
  "id": "github-trending-20260812-002",
  "title": "obra/superpowers",
  "source": "github-trending",
  "source_url": "https://github.com/obra/superpowers",
  "author": "obra",
  "summary": "superpowers 是一个开源的 Agentic 技能框架与软件开发工具，旨在为 AI 代理提供可组合、可复用的技能模块，提升开发效率与自动化能力。",
  "content": "## 项目概述\n\n**superpowers** 是一个开源的 **Agentic 技能框架**，专注于软件开发场景。它提供了一套结构化的方式来定义、组织和管理 AI 代理（Agent）可执行的技能（Skills），使得代理能够更高效地完成复杂的开发任务。该项目在 GitHub 上热度极高（270k+），表明其受到了开发者社区的广泛关注。\n\n## 核心特性\n\n- **技能框架**：核心是“技能”的概念，将特定任务或能力封装为可复用的模块。\n- **模块化与组合**：支持将多个技能组合成更复杂的工作流，灵活应对不同开发需求。\n- **软件开发导向**：专门针对编码、调试、测试、代码审查等软件开发环节设计。\n- **开源与社区驱动**：代码完全开源，鼓励社区贡献新的技能和最佳实践。\n\n## 适用场景\n\n- **AI 辅助编程**：为 IDE 或 CLI 中的 AI 助手提供更专业、更可控的技能集。\n- **自动化开发流水线**：在 CI/CD 或自动化脚本中，让 Agent 根据技能定义执行特定步骤。\n- **构建自定义 Agent**：开发者可以基于该框架快速搭建针对特定技术栈或业务逻辑的专用 Agent。\n\n## 技术要点\n\n- 框架设计强调**可扩展性**，用户可轻松添加自定义技能。\n- 与现有开发工具链（如 Git、包管理器）有良好的集成潜力。\n- 通过结构化技能定义，降低 Agent 行为的不确定性，提升任务执行的成功率。\n\n## 总结\n\nsuperpowers 为 AI Agent 在软件开发领域的落地提供了一个坚实的框架基础。它通过“技能”抽象，解决了 Agent 能力复用和任务编排的痛点，是值得关注和尝试的 Agent 开发工具。",
  "highlights": [
    "Agentic 技能框架，支持模块化组合与复用",
    "面向软件开发场景，提升 AI 代理的自动化能力",
    "开源项目，社区活跃，热度高（270k+）"
  ],
  "score_reason": "直接相关 AI Agent 开发框架，属于 agent 与 framework 领域的热门开源项目，对构建智能体应用有较高参考价值。",
  "tags": [
    "agent",
    "framework",
    "open-source",
    "tool-use",
    "deployment"
  ],
  "relevance_score": 0.8,
  "collected_at": "2026-08-12T17:04:38.564414+08:00",
  "analyzed_at": "2026-08-12T17:04:57.505616+08:00",
  "status": "reviewed"
}