{
  "id": "hackernews-20260814-005",
  "title": "Categorization with NLP",
  "source": "hackernews",
  "source_url": "https://softwaremaniacs.org/blog/2026/07/30/categorization-with-nlp/",
  "author": "N/A",
  "summary": "一篇关于使用NLP技术进行文本分类的实践文章，探讨了从传统方法到现代LLM的分类方案选择。",
  "content": "## 项目概述\n\n本文是作者在软件博客上发布的一篇技术文章，标题为“Categorization with NLP”，主要探讨如何利用自然语言处理技术对文本进行分类。文章基于作者的实际经验，分析了不同分类方法的适用场景和性能表现。\n\n## 核心特性\n\n- **方法对比**：文章对比了传统机器学习方法（如TF-IDF + 分类器）与基于Transformer的模型（如BERT、LLM）在分类任务上的效果。\n- **选型建议**：根据数据规模、标注成本、实时性要求等因素，给出了选择分类方案的决策树。\n- **评估指标**：讨论了准确率、召回率、F1分数等指标在分类任务中的重要性，并强调了类别不平衡问题。\n- **调优技巧**：分享了如何通过数据增强、模型微调、提示工程等技巧提升分类性能。\n\n## 适用场景\n\n- 内容审核（如垃圾邮件过滤、评论分类）\n- 文档自动归档（如新闻分类、工单分类）\n- 用户意图识别（如客服机器人）\n\n## 总结\n\n文章是一篇实用的技术指南，适合需要落地文本分类功能的开发者参考。虽然未涉及前沿研究，但提供了清晰的实践路径和权衡分析。",
  "highlights": [
    "对比了传统机器学习与LLM在文本分类上的优劣",
    "提供了实际项目中的分类方案选型建议",
    "讨论了分类任务的评估与调优策略"
  ],
  "score_reason": "文章涉及NLP分类技术，与AI/LLM应用相关，但非突破性研究，属于实践性内容，适合关注文本分类的开发者。",
  "tags": [
    "llm",
    "fine-tuning",
    "framework",
    "tutorial"
  ],
  "relevance_score": 0.6,
  "collected_at": "2026-08-14T17:00:51.559646+08:00",
  "analyzed_at": "2026-08-14T17:03:21.411697+08:00",
  "status": "reviewed"
}