{
  "id": "hackernews-20260806-006",
  "title": "Why we write our own C and C++ inference engines",
  "source": "hackernews",
  "source_url": "https://localai.io/blog/why-we-write-our-own-engines/",
  "author": "N/A",
  "summary": "LocalAI 团队解释为何自研 C/C++ 推理引擎，强调性能、可控性与灵活性，避免依赖外部框架的限制。",
  "content": "## 项目概述\n\nLocalAI 团队在博客中阐述了他们选择自研 C/C++ 推理引擎的原因。LocalAI 是一个开源、本地优先的 AI 推理平台，旨在提供与 OpenAI API 兼容的接口，同时支持多种模型格式。团队认为，依赖现成的推理框架（如 llama.cpp、TensorRT 等）虽然方便，但存在性能、灵活性和控制力方面的局限，因此决定开发自己的引擎。\n\n## 核心特性\n\n- **性能优化**：自研引擎可以针对特定硬件（如 CPU、GPU、NPU）和模型架构进行深度优化，减少不必要的开销，提升推理速度和吞吐量。\n- **可控性与可维护性**：减少外部依赖，降低供应链风险，同时代码库更易于理解和定制，便于快速修复问题和添加新功能。\n- **灵活性**：支持多种模型格式（如 GGUF、ONNX 等），并允许自定义算子，方便集成到不同应用场景中。\n- **安全与隐私**：本地推理，数据不出服务器，满足隐私合规要求。\n\n## 适用场景\n\n- 需要高性能本地推理的边缘设备或私有化部署场景。\n- 对模型推理有特殊优化需求（如自定义算子、量化策略）的开发者。\n- 希望减少对第三方框架依赖，追求长期可控性的团队。\n\n## 总结\n\nLocalAI 的自研引擎策略体现了对性能和控制力的极致追求，适合对推理效率有高要求且愿意投入工程成本的团队。文章提供了技术选型上的思考，对 AI 基础设施开发者有参考价值。",
  "highlights": [
    "自研引擎可针对特定硬件和模型优化，提升推理性能",
    "减少外部依赖，增强安全性和可维护性",
    "灵活支持多种模型格式和自定义算子，便于集成"
  ],
  "score_reason": "文章聚焦推理引擎的底层实现，与AI部署和性能优化高度相关，但非LLM或Agent核心创新，故评分7。",
  "tags": [
    "deployment",
    "framework",
    "open-source"
  ],
  "relevance_score": 0.7,
  "collected_at": "2026-08-06T18:32:15.193725+08:00",
  "analyzed_at": "2026-08-06T18:35:01.682351+08:00",
  "status": "reviewed"
}