{
  "id": "github-trending-20260807-005",
  "title": "n8n-io/n8n",
  "source": "github-trending",
  "source_url": "https://github.com/n8n-io/n8n",
  "author": "n8n-io",
  "summary": "n8n 是一个开源的工作流自动化平台，通过可视化界面和原生 AI 集成，支持构建复杂的自动化流程和 AI Agent。",
  "content": "## 项目概述\n\nn8n 是一个 **Fair-code** 许可的开源工作流自动化平台，旨在通过可视化界面简化复杂流程的构建。它结合了可视化编程的易用性与代码的灵活性，支持超过 400 个集成应用，并原生支持 AI 功能，使其成为构建自动化流程和 AI Agent 的热门选择。\n\n## 核心特性\n\n- **可视化工作流编辑器**：拖拽节点即可构建流程，支持条件分支、循环、错误处理等逻辑。\n- **原生 AI 集成**：内置 AI Agent 节点，可连接 OpenAI、Anthropic 等 LLM，支持构建 RAG 流程、工具调用等。\n- **Fair-code 许可**：源代码开放，但允许商业使用，提供自托管（Community 版）和云服务（Cloud 版）。\n- **丰富的节点库**：支持 HTTP 请求、数据库、消息队列、CRM 等数百种集成。\n- **可扩展性**：支持自定义节点和 JavaScript 代码片段，满足复杂需求。\n\n## 适用场景\n\n- **自动化运维**：定时任务、数据同步、告警通知等。\n- **AI 应用开发**：构建客服机器人、文档问答、内容生成等 AI 工作流。\n- **业务流程自动化**：将 CRM、ERP、邮件等系统串联，减少人工操作。\n\n## 总结\n\nn8n 是一个功能强大且灵活的工作流自动化工具，尤其适合需要快速集成 AI 能力的团队。其可视化界面降低了使用门槛，同时保留代码扩展能力，是构建 AI Agent 和自动化流程的优选框架之一。",
  "highlights": [
    "可视化工作流编辑器，支持拖拽式构建自动化流程",
    "原生 AI 与 Agent 支持，可集成 LLM、RAG 等能力",
    "Fair-code 许可，提供自托管和云服务选项"
  ],
  "score_reason": "n8n 作为工作流自动化平台，深度集成 AI 功能，支持构建 Agent 和 RAG 流程，与 AI 技术高度相关，但非纯 AI 项目，故评 8 分。",
  "tags": [
    "agent",
    "framework",
    "open-source",
    "deployment",
    "tool-use"
  ],
  "relevance_score": 0.8,
  "collected_at": "2026-08-07T16:49:31.275076+08:00",
  "analyzed_at": "2026-08-07T16:50:06.030692+08:00",
  "status": "reviewed"
}