{
  "id": "github-trending-20260803-005",
  "title": "n8n-io/n8n",
  "source": "github-trending",
  "source_url": "https://github.com/n8n-io/n8n",
  "author": "n8n-io",
  "summary": "n8n 是一个开源的可视化工作流自动化平台，支持原生 AI 集成，通过拖拽方式构建复杂自动化流程，兼具灵活性与公平代码许可。",
  "content": "## 项目概述\n\nn8n 是一个 **Fair-code** 许可的开源工作流自动化平台，旨在通过可视化界面让用户轻松构建自动化流程。它结合了拖拽式编辑器的易用性与代码的灵活性，支持从简单任务到复杂 AI 工作流的编排。\n\n## 核心特性\n\n- **可视化工作流编辑器**：通过拖拽节点连接不同服务，无需编写代码即可创建自动化流程。\n- **原生 AI 集成**：内置 AI 节点，支持接入 LLM（如 OpenAI）、Agent 框架、RAG 等，可构建智能自动化。\n- **Fair-code 许可**：采用 Sustainable Use License，允许非商业使用和自托管，同时保护商业利益。\n- **自托管支持**：可部署在自己的服务器上，确保数据隐私和合规性。\n- **丰富的节点库**：提供超过 400 个集成节点，覆盖数据库、API、消息服务等。\n\n## 适用场景\n\n- **自动化业务流程**：如数据同步、通知推送、报表生成。\n- **AI 工作流编排**：结合 LLM 和工具调用，实现智能客服、内容生成、数据分析等。\n- **内部工具搭建**：快速构建团队内部使用的自动化工具。\n- **原型验证**：快速验证自动化想法，降低开发成本。\n\n## 技术亮点\n\n- 支持 JavaScript 自定义节点，扩展性强。\n- 提供云服务版本（n8n Cloud）和自托管版本。\n- 活跃的社区和丰富的模板库。\n\n## 总结\n\nn8n 是一个功能强大且灵活的工作流自动化平台，特别适合需要集成 AI 能力的自动化场景。其 Fair-code 许可和自托管选项使其成为企业和开发者的热门选择。",
  "highlights": [
    "可视化拖拽式工作流编辑器，无需代码即可构建自动化",
    "原生支持 AI 节点，可集成 LLM、Agent 等能力",
    "Fair-code 许可，兼顾开源与商业可持续性",
    "支持自托管，数据隐私可控",
    "拥有丰富的节点库，连接数百种应用与服务"
  ],
  "score_reason": "n8n 是高度相关的 AI 工作流自动化工具，原生支持 AI/Agent 集成，但非纯 AI 项目，评分 7 分。",
  "tags": [
    "framework",
    "agent",
    "llm",
    "open-source",
    "deployment"
  ],
  "relevance_score": 0.7,
  "collected_at": "2026-08-03T19:15:17.984707+08:00",
  "analyzed_at": "2026-08-03T19:15:55.763203+08:00",
  "status": "reviewed"
}