{
  "id": "github-trending-20260804-016",
  "title": "github/spec-kit",
  "source": "github-trending",
  "source_url": "https://github.com/github/spec-kit",
  "author": "github",
  "summary": "spec-kit 是 GitHub 官方推出的规范驱动开发（Spec-Driven Development）工具包，旨在帮助开发者快速启动基于规范（如 OpenAPI）的 API 开发流程。",
  "content": "## 项目概述\n\n**spec-kit** 是 GitHub 官方发布的一个开源工具包，专注于 **Spec-Driven Development（规范驱动开发）**。其核心目标是帮助开发者从 API 规范（如 OpenAPI/Swagger）出发，快速生成项目骨架、客户端代码或服务端存根，从而减少重复劳动并保证实现与规范的一致性。\n\n## 核心特性\n\n- **规范优先**：以机器可读的规范文件作为单一事实来源，驱动整个开发流程。\n- **快速启动**：提供命令行工具，可一键生成项目结构，降低新项目或微服务的初始化成本。\n- **官方维护**：由 GitHub 团队维护，代码质量、文档和后续更新有较好保障。\n\n## 适用场景\n\n- 团队采用 API-first 或契约优先的开发流程。\n- 需要快速为多个微服务生成统一的代码骨架。\n- 希望将 API 规范与代码实现进行强绑定，减少文档与代码脱节的问题。\n\n## 与 AI 的关联\n\n虽然 spec-kit 本身不包含 AI 能力，但在 AI 辅助编程场景下，它可以作为**工具调用（tool-use）** 的候选工具：AI 可以读取规范文件后调用 spec-kit 生成代码，或根据生成的代码反向校验规范。对于构建 AI 驱动的 API 开发工作流，这是一个有价值的底层工具。\n\n## 总结\n\n对于关注 API 工程化和开发效率的开发者，spec-kit 是一个值得尝试的官方工具。它不直接涉及 AI 技术，但在 AI 辅助开发链路中可作为可靠的基础设施组件。",
  "highlights": [
    "GitHub 官方出品，权威性和质量有保障",
    "聚焦 Spec-Driven 开发范式，提升 API 设计到实现的一致性",
    "提供脚手架工具，降低项目初始化门槛"
  ],
  "score_reason": "该工具与 AI/LLM 无直接关联，但属于开发者工具链，对使用 AI 生成 API 代码或规范的工作流有间接辅助作用。",
  "tags": [
    "framework",
    "open-source",
    "tool-use"
  ],
  "relevance_score": 0.5,
  "collected_at": "2026-08-04T18:29:47.461760+08:00",
  "analyzed_at": "2026-08-04T18:32:50.147230+08:00",
  "status": "reviewed"
}