{
  "id": "hackernews-20260811-017",
  "title": "Robust AI Security and Alignment: A Sisyphean Endeavor?",
  "source": "hackernews",
  "source_url": "https://ieeexplore.ieee.org/document/11475847/",
  "author": "N/A",
  "summary": "本文探讨AI安全与对齐的鲁棒性挑战，引用NIST数学证明，指出持续监控与更新是应对AI系统脆弱性的必要手段，但可能陷入西西弗斯式的无尽循环。",
  "content": "## 项目概述\n\n本文是一篇学术论文，标题为《Robust AI Security and Alignment: A Sisyphean Endeavor?》，发表于IEEE，并得到NIST官方文章的推荐。论文核心围绕AI安全与对齐的鲁棒性问题，探讨为何AI系统在面对对抗性攻击和分布偏移时难以保持稳定，以及为何持续监控与更新成为必要但可能永无止境的任务。\n\n## 核心特性\n\n- **数学证明支撑**：NIST提供数学证明，表明AI系统无法通过一次性训练达到永久安全，必须持续监控和更新。\n- **鲁棒性挑战**：深入分析AI模型在对抗样本、数据漂移等场景下的脆弱性，揭示对齐失败的根源。\n- **西西弗斯隐喻**：将AI安全维护比作希腊神话中的西西弗斯推石上山，强调其重复性与艰巨性。\n- **实践建议**：提出动态评估与更新机制，作为缓解安全风险的可能路径。\n\n## 适用场景\n\n- AI安全研究人员：理解对齐鲁棒性的理论边界。\n- 政策制定者：参考NIST建议，制定AI监管与更新标准。\n- 开发者：在部署AI系统时，规划持续监控与更新流程。\n\n## 总结\n\n本文通过严谨的数学论证和哲学隐喻，揭示了AI安全对齐的深层困境，为行业提供了重要的理论参考，并引发对“安全是否可达”的反思。",
  "highlights": [
    "NIST数学证明支持AI系统需持续监控与更新",
    "深入分析AI对齐的鲁棒性难题及安全挑战",
    "提出“西西弗斯式”隐喻，反思安全工作的长期性"
  ],
  "score_reason": "直接聚焦AI安全与对齐这一核心议题，结合NIST最新研究，对理解AI系统脆弱性及防御策略有重要参考价值，高度相关。",
  "tags": [
    "safety",
    "evaluation",
    "paper",
    "opinion"
  ],
  "relevance_score": 0.8,
  "collected_at": "2026-08-11T16:46:16.259201+08:00",
  "analyzed_at": "2026-08-11T16:49:18.932748+08:00",
  "status": "reviewed"
}